ReviewID,ProductID,UserID,Rating,ReviewText,ReviewDate,Review #,Brand,Variety,Style,Country,Stars,Top Ten
REV2594,Product_A,User_154,4.0,easy to use. great value.,2024-06-27,,,,,,,
REV2595,Product_A,User_157,2.0,terrible product. waste of money.,2023-04-07,,,,,,,
REV2596,Product_E,User_134,3.0,met expectations. waste of money.,2023-02-08,,,,,,,
REV2597,Product_A,User_175,2.0,does not work. customer service was bad.,2024-04-15,,,,,,,
REV2598,Product_E,User_136,1.0,bad experience. customer service was bad.,2024-08-21,,,,,,,
REV2599,Product_A,User_184,5.0,great value. very satisfied.,2024-03-25,,,,,,,
REV2600,Product_A,User_131,1.0,customer service was bad. worst purchase.,2024-05-13,,,,,,,
REV2601,Product_C,User_135,4.0,amazing features. best purchase ever.,2024-11-04,,,,,,,
REV2602,Product_D,User_123,3.0,some pros and cons. love this product.,2024-08-06,,,,,,,
REV2603,Product_C,User_173,3.0,it's okay. excellent quality.,2023-06-24,,,,,,,
REV2604,Product_E,User_100,3.0,it's okay. wonderful experience.,2023-04-03,,,,,,,
REV2605,Product_B,User_116,5.0,wonderful experience. great value.,2023-03-12,,,,,,,
REV2606,Product_B,User_148,3.0,decent for the price. customer service was bad.,2023-04-13,,,,,,,
REV2607,Product_C,User_124,1.0,bad experience. does not work.,2023-09-08,,,,,,,
REV2608,Product_C,User_131,5.0,amazing features. very satisfied.,2024-01-15,,,,,,,
REV2609,Product_E,User_185,1.0,missing features. does not work. met expectations.,2023-12-02,,,,,,,
REV2610,Product_E,User_182,1.0,poor quality. missing features.,2024-10-20,,,,,,,
REV2611,Product_C,User_152,3.0,some pros and cons. does not work.,2024-06-25,,,,,,,
REV2612,Product_D,User_156,2.0,one star. would not recommend.,2023-10-19,,,,,,,
REV2613,Product_B,User_165,5.0,wonderful experience. very satisfied.,2023-11-29,,,,,,,
REV2614,Product_C,User_192,5.0,works perfectly. works perfectly.,2023-11-19,,,,,,,
REV2615,Product_D,User_159,3.0,average product. terrible product.,2023-05-02,,,,,,,
REV2616,Product_D,User_130,1.0,poor quality. bad experience. some pros and cons.,2023-05-04,,,,,,,
REV2617,Product_A,User_157,4.0,wonderful experience. easy to use.,2024-01-03,,,,,,,
REV2618,Product_A,User_198,4.0,works perfectly. five stars.,2024-04-29,,,,,,,
REV2619,Product_A,User_191,4.0,love this product. easy to use.,2024-03-17,,,,,,,
REV2620,Product_B,User_135,5.0,great value. great value.,2024-05-04,,,,,,,
REV2621,Product_D,User_141,2.0,bad experience. broke easily. could be better.,2024-03-20,,,,,,,
REV2622,Product_A,User_139,3.0,average product. five stars.,2023-08-25,,,,,,,
REV2623,Product_D,User_110,2.0,terrible product. worst purchase.,2023-07-26,,,,,,,
REV2624,Product_C,User_189,4.0,love this product. very satisfied.,2024-10-19,,,,,,,
REV2625,Product_C,User_193,3.0,it's okay. one star.,2023-03-02,,,,,,,
REV2626,Product_B,User_112,5.0,easy to use. great value.,2024-08-08,,,,,,,
REV2627,Product_D,User_183,4.0,love this product. five stars. decent for the price.,2023-07-23,,,,,,,
REV2628,Product_E,User_195,5.0,great value. five stars. average product.,2024-11-05,,,,,,,
REV2629,Product_C,User_128,1.0,awful. bad experience.,2024-03-30,,,,,,,
REV2630,Product_C,User_196,2.0,bad experience. very disappointed. nothing special.,2023-07-01,,,,,,,
REV2631,Product_C,User_160,4.0,wonderful experience. best purchase ever. works as expected.,2023-04-01,,,,,,,
REV2632,Product_E,User_134,5.0,exceeded expectations. great value.,2024-04-03,,,,,,,
REV2633,Product_D,User_147,3.0,works as expected. fantastic.,2024-05-15,,,,,,,
REV2634,Product_A,User_195,2.0,difficult to use. broke easily. works as expected.,2023-12-22,,,,,,,
REV2635,Product_E,User_109,5.0,amazing features. highly recommend.,2023-12-05,,,,,,,
REV2636,Product_C,User_165,3.0,some pros and cons. works perfectly.,2023-03-15,,,,,,,
REV2637,Product_B,User_154,3.0,decent for the price. waste of money.,2024-06-23,,,,,,,
REV2638,Product_E,User_111,3.0,nothing special. worst purchase.,2024-07-15,,,,,,,
REV2639,Product_A,User_113,4.0,exceeded expectations. wonderful experience.,2024-12-15,,,,,,,
REV2640,Product_C,User_120,2.0,difficult to use. missing features.,2024-10-06,,,,,,,
REV2641,Product_A,User_153,1.0,very disappointed. does not work.,2024-04-02,,,,,,,
REV2642,Product_A,User_114,4.0,five stars. very satisfied.,2024-09-07,,,,,,,
REV2643,Product_E,User_145,1.0,poor quality. would not recommend.,2024-10-15,,,,,,,
REV2644,Product_C,User_142,1.0,one star. awful.,2023-07-26,,,,,,,
REV2645,Product_D,User_155,3.0,average product. very disappointed.,2023-03-31,,,,,,,
REV2646,Product_D,User_153,2.0,broke easily. awful. met expectations.,2024-06-21,,,,,,,
REV2647,Product_E,User_139,4.0,highly recommend. highly recommend. neither good nor bad.,2024-12-21,,,,,,,
REV2648,Product_C,User_155,5.0,great value. easy to use. some pros and cons.,2023-06-04,,,,,,,
REV2649,Product_C,User_183,3.0,it's okay. difficult to use.,2023-08-22,,,,,,,
REV2650,Product_E,User_193,1.0,would not recommend. one star. neither good nor bad.,2024-01-01,,,,,,,
REV2651,Product_A,User_116,4.0,best purchase ever. wonderful experience. average product.,2023-03-05,,,,,,,
REV2652,Product_D,User_157,2.0,poor quality. very disappointed.,2023-10-03,,,,,,,
REV2653,Product_E,User_183,4.0,amazing features. fantastic. could be better.,2024-09-29,,,,,,,
REV2654,Product_E,User_193,3.0,neither good nor bad. highly recommend.,2024-07-21,,,,,,,
REV2655,Product_E,User_195,5.0,great value. best purchase ever.,2023-02-05,,,,,,,
REV2656,Product_B,User_130,2.0,broke easily. one star.,2024-01-10,,,,,,,
REV2657,Product_B,User_139,5.0,fantastic. works perfectly. neither good nor bad.,2023-05-08,,,,,,,
REV2658,Product_A,User_194,1.0,missing features. difficult to use. could be better.,2024-05-04,,,,,,,
REV2659,Product_A,User_121,2.0,poor quality. does not work.,2023-03-30,,,,,,,
REV2660,Product_B,User_114,1.0,difficult to use. bad experience.,2024-05-17,,,,,,,
REV2661,Product_D,User_189,1.0,bad experience. missing features.,2023-03-23,,,,,,,
REV2662,Product_C,User_159,4.0,amazing features. works perfectly.,2023-11-23,,,,,,,
REV2663,Product_C,User_188,4.0,fantastic. wonderful experience.,2023-08-12,,,,,,,
REV2664,Product_E,User_105,1.0,missing features. one star.,2024-08-11,,,,,,,
REV2665,Product_D,User_138,4.0,amazing features. wonderful experience.,2023-03-13,,,,,,,
REV2666,Product_E,User_193,4.0,five stars. works perfectly. average product.,2024-03-26,,,,,,,
REV2667,Product_A,User_105,5.0,works perfectly. best purchase ever.,2023-07-25,,,,,,,
REV2668,Product_D,User_148,3.0,decent for the price. amazing features.,2023-12-15,,,,,,,
REV2669,Product_E,User_183,1.0,very disappointed. would not recommend. average product.,2024-05-01,,,,,,,
REV2670,Product_D,User_176,1.0,very disappointed. would not recommend.,2023-12-03,,,,,,,
REV2671,Product_A,User_123,5.0,fantastic. excellent quality.,2023-02-27,,,,,,,
REV2672,Product_B,User_158,3.0,it's okay. bad experience.,2023-08-17,,,,,,,
REV2673,Product_B,User_116,2.0,difficult to use. bad experience.,2023-10-13,,,,,,,
REV2674,Product_B,User_112,5.0,great value. great value. it's okay.,2023-06-20,,,,,,,
REV2675,Product_D,User_114,3.0,nothing special. waste of money.,2023-07-20,,,,,,,
REV2676,Product_A,User_156,4.0,amazing features. very satisfied.,2023-11-04,,,,,,,
REV2677,Product_C,User_174,4.0,amazing features. five stars.,2023-04-08,,,,,,,
REV2678,Product_A,User_107,1.0,broke easily. customer service was bad.,2023-03-13,,,,,,,
REV2679,Product_B,User_161,3.0,neither good nor bad. love this product.,2023-05-19,,,,,,,
REV2680,Product_B,User_192,1.0,waste of money. awful.,2024-12-25,,,,,,,
REV2681,Product_E,User_163,2.0,very disappointed. awful.,2024-05-13,,,,,,,
REV2682,Product_C,User_110,3.0,works as expected. fantastic.,2023-05-29,,,,,,,
REV2683,Product_D,User_116,3.0,works as expected. five stars.,2023-01-06,,,,,,,
REV2684,Product_E,User_167,2.0,worst purchase. terrible product. nothing special.,2024-12-26,,,,,,,
REV2685,Product_A,User_199,2.0,one star. customer service was bad.,2023-09-04,,,,,,,
REV2686,Product_C,User_155,4.0,fantastic. love this product.,2023-07-29,,,,,,,
REV2687,Product_D,User_137,2.0,broke easily. missing features. could be better.,2024-05-06,,,,,,,
REV2688,Product_E,User_124,4.0,excellent quality. works perfectly. met expectations.,2024-05-25,,,,,,,
REV2689,Product_A,User_125,2.0,worst purchase. does not work.,2023-12-26,,,,,,,
REV2690,Product_C,User_157,5.0,love this product. works perfectly. decent for the price.,2023-10-10,,,,,,,
REV2691,Product_B,User_146,4.0,easy to use. excellent quality.,2023-06-11,,,,,,,
REV2692,Product_A,User_188,4.0,works perfectly. best purchase ever.,2024-07-31,,,,,,,
REV2693,Product_A,User_185,4.0,wonderful experience. love this product. nothing special.,2024-04-13,,,,,,,
REV2694,Product_E,User_187,1.0,terrible product. broke easily.,2023-03-11,,,,,,,
REV2695,Product_C,User_117,4.0,five stars. works perfectly.,2024-10-22,,,,,,,
REV2696,Product_B,User_109,3.0,nothing special. easy to use.,2023-12-11,,,,,,,
REV2697,Product_E,User_163,3.0,decent for the price. fantastic.,2023-01-05,,,,,,,
REV2698,Product_E,User_192,3.0,some pros and cons. poor quality.,2023-07-16,,,,,,,
REV2699,Product_D,User_150,1.0,broke easily. one star. neither good nor bad.,2023-01-30,,,,,,,
REV2700,Product_E,User_171,2.0,bad experience. very disappointed.,2024-03-20,,,,,,,
REV2701,Product_B,User_184,1.0,poor quality. difficult to use. some pros and cons.,2024-11-26,,,,,,,
REV2702,Product_A,User_154,4.0,fantastic. great value.,2023-10-05,,,,,,,
REV2703,Product_A,User_162,1.0,very disappointed. worst purchase.,2024-05-04,,,,,,,
REV2704,Product_C,User_179,1.0,customer service was bad. terrible product.,2023-01-08,,,,,,,
REV2705,Product_E,User_116,2.0,terrible product. customer service was bad.,2023-06-15,,,,,,,
REV2706,Product_E,User_114,3.0,it's okay. fantastic.,2024-05-23,,,,,,,
REV2707,Product_D,User_105,3.0,met expectations. easy to use.,2024-12-09,,,,,,,
REV2708,Product_B,User_125,1.0,worst purchase. would not recommend. average product.,2023-01-05,,,,,,,
REV2709,Product_D,User_116,2.0,customer service was bad. customer service was bad. neither good nor bad.,2023-09-06,,,,,,,
REV2710,Product_C,User_134,3.0,works as expected. highly recommend.,2023-12-03,,,,,,,
REV2711,Product_B,User_147,3.0,could be better. wonderful experience.,2023-02-13,,,,,,,
REV2712,Product_C,User_149,1.0,does not work. would not recommend.,2023-03-06,,,,,,,
REV2713,Product_E,User_178,2.0,one star. customer service was bad. average product.,2023-07-06,,,,,,,
REV2714,Product_C,User_130,3.0,neither good nor bad. fantastic.,2023-07-20,,,,,,,
REV2715,Product_C,User_156,4.0,very satisfied. excellent quality. decent for the price.,2024-04-02,,,,,,,
REV2716,Product_D,User_197,5.0,wonderful experience. easy to use.,2023-06-20,,,,,,,
REV2717,Product_E,User_103,2.0,difficult to use. very disappointed. average product.,2023-04-03,,,,,,,
REV2718,Product_A,User_173,2.0,very disappointed. awful. works as expected.,2023-07-31,,,,,,,
REV2719,Product_C,User_142,2.0,would not recommend. would not recommend. works as expected.,2024-02-05,,,,,,,
REV2720,Product_C,User_121,5.0,highly recommend. very satisfied.,2023-07-12,,,,,,,
REV2721,Product_E,User_102,3.0,neither good nor bad. excellent quality.,2024-01-28,,,,,,,
REV2722,Product_C,User_172,1.0,does not work. bad experience. nothing special.,2024-12-14,,,,,,,
REV2723,Product_D,User_197,1.0,awful. missing features.,2023-08-25,,,,,,,
REV2724,Product_A,User_157,2.0,difficult to use. missing features. works as expected.,2024-08-28,,,,,,,
REV2725,Product_B,User_109,4.0,exceeded expectations. exceeded expectations.,2023-04-09,,,,,,,
REV2726,Product_A,User_163,5.0,excellent quality. five stars. average product.,2024-07-29,,,,,,,
REV2727,Product_C,User_115,3.0,works as expected. great value.,2023-08-29,,,,,,,
REV2728,Product_B,User_115,3.0,some pros and cons. worst purchase.,2023-09-19,,,,,,,
REV2729,Product_D,User_176,4.0,best purchase ever. exceeded expectations.,2024-10-03,,,,,,,
REV2730,Product_D,User_112,4.0,love this product. wonderful experience.,2024-07-08,,,,,,,
REV2731,Product_E,User_107,4.0,highly recommend. five stars. decent for the price.,2023-03-31,,,,,,,
REV2732,Product_E,User_151,2.0,bad experience. waste of money.,2023-05-04,,,,,,,
REV2733,Product_D,User_118,4.0,best purchase ever. great value.,2024-04-05,,,,,,,
REV2734,Product_D,User_128,3.0,some pros and cons. highly recommend.,2024-10-21,,,,,,,
REV2735,Product_B,User_168,2.0,bad experience. does not work.,2023-01-30,,,,,,,
REV2736,Product_C,User_161,5.0,highly recommend. very satisfied.,2023-08-09,,,,,,,
REV2737,Product_A,User_118,4.0,very satisfied. highly recommend.,2024-07-03,,,,,,,
REV2738,Product_D,User_108,1.0,would not recommend. poor quality.,2023-10-15,,,,,,,
REV2739,Product_C,User_136,4.0,best purchase ever. highly recommend. average product.,2023-10-05,,,,,,,
REV2740,Product_B,User_108,5.0,easy to use. highly recommend.,2024-09-09,,,,,,,
REV2741,Product_A,User_184,3.0,works as expected. poor quality.,2023-07-08,,,,,,,
REV2742,Product_D,User_109,3.0,average product. love this product.,2023-05-10,,,,,,,
REV2743,Product_C,User_187,5.0,exceeded expectations. easy to use. neither good nor bad.,2023-05-09,,,,,,,
REV2744,Product_B,User_111,2.0,terrible product. terrible product.,2024-08-29,,,,,,,
REV2745,Product_D,User_152,1.0,difficult to use. poor quality.,2024-09-09,,,,,,,
REV2746,Product_D,User_118,4.0,exceeded expectations. fantastic. works as expected.,2024-02-14,,,,,,,
REV2747,Product_C,User_126,4.0,excellent quality. love this product.,2023-07-01,,,,,,,
REV2748,Product_D,User_137,4.0,wonderful experience. best purchase ever.,2023-04-06,,,,,,,
REV2749,Product_E,User_141,1.0,waste of money. very disappointed. met expectations.,2023-10-30,,,,,,,
REV2750,Product_D,User_126,1.0,poor quality. worst purchase.,2024-07-06,,,,,,,
REV2751,Product_A,User_175,4.0,best purchase ever. amazing features. nothing special.,2023-07-20,,,,,,,
REV2752,Product_B,User_164,4.0,five stars. highly recommend. average product.,2024-03-10,,,,,,,
REV2753,Product_B,User_128,1.0,one star. waste of money.,2024-06-10,,,,,,,
REV2754,Product_E,User_109,5.0,great value. excellent quality. average product.,2024-09-13,,,,,,,
REV2755,Product_D,User_121,2.0,would not recommend. bad experience. nothing special.,2024-03-29,,,,,,,
REV2756,Product_A,User_144,1.0,would not recommend. poor quality.,2023-06-13,,,,,,,
REV2757,Product_C,User_115,5.0,great value. highly recommend.,2024-11-29,,,,,,,
REV2758,Product_D,User_115,3.0,neither good nor bad. difficult to use.,2023-12-03,,,,,,,
REV2759,Product_A,User_140,4.0,five stars. excellent quality.,2023-11-06,,,,,,,
REV2760,Product_D,User_186,3.0,it's okay. works perfectly.,2024-09-07,,,,,,,
REV2761,Product_D,User_182,1.0,very disappointed. customer service was bad.,2023-04-20,,,,,,,
REV2762,Product_C,User_183,5.0,great value. amazing features.,2023-10-18,,,,,,,
REV2763,Product_B,User_144,1.0,broke easily. missing features.,2024-05-22,,,,,,,
REV2764,Product_D,User_143,1.0,broke easily. difficult to use.,2024-08-30,,,,,,,
REV2765,Product_E,User_153,3.0,works as expected. does not work.,2024-12-30,,,,,,,
REV2766,Product_B,User_152,1.0,terrible product. terrible product.,2023-04-21,,,,,,,
REV2767,Product_E,User_150,4.0,works perfectly. five stars. nothing special.,2024-11-03,,,,,,,
REV2768,Product_D,User_172,5.0,highly recommend. works perfectly.,2024-11-09,,,,,,,
REV2769,Product_E,User_142,3.0,some pros and cons. highly recommend.,2024-10-14,,,,,,,
REV2770,Product_E,User_185,5.0,works perfectly. fantastic. works as expected.,2023-02-12,,,,,,,
REV2771,Product_C,User_176,2.0,would not recommend. awful. neither good nor bad.,2023-05-17,,,,,,,
REV2772,Product_D,User_178,3.0,met expectations. does not work.,2024-03-14,,,,,,,
REV2773,Product_A,User_141,4.0,love this product. works perfectly.,2023-08-08,,,,,,,
REV2774,Product_D,User_146,3.0,neither good nor bad. bad experience.,2024-01-11,,,,,,,
REV2775,Product_A,User_111,4.0,very satisfied. five stars.,2024-10-27,,,,,,,
REV2776,Product_E,User_145,5.0,amazing features. wonderful experience.,2024-08-22,,,,,,,
REV2777,Product_D,User_103,1.0,terrible product. difficult to use.,2023-03-16,,,,,,,
REV2778,Product_D,User_153,3.0,neither good nor bad. exceeded expectations.,2023-08-03,,,,,,,
REV2779,Product_B,User_124,1.0,bad experience. does not work. works as expected.,2023-02-23,,,,,,,
REV2780,Product_A,User_166,4.0,highly recommend. wonderful experience.,2024-12-20,,,,,,,
REV2781,Product_C,User_146,1.0,very disappointed. would not recommend.,2023-06-30,,,,,,,
REV2782,Product_B,User_106,1.0,terrible product. poor quality. some pros and cons.,2023-10-05,,,,,,,
REV2783,Product_B,User_190,5.0,love this product. five stars.,2024-11-03,,,,,,,
REV2784,Product_D,User_116,2.0,broke easily. very disappointed. it's okay.,2024-10-05,,,,,,,
REV2785,Product_A,User_160,2.0,awful. bad experience. nothing special.,2023-10-18,,,,,,,
REV2786,Product_D,User_142,2.0,customer service was bad. missing features.,2023-10-10,,,,,,,
REV2787,Product_E,User_115,4.0,exceeded expectations. exceeded expectations.,2023-12-21,,,,,,,
REV2788,Product_A,User_138,5.0,best purchase ever. easy to use.,2023-10-31,,,,,,,
REV2789,Product_B,User_111,3.0,nothing special. waste of money.,2023-08-10,,,,,,,
REV2790,Product_A,User_157,5.0,best purchase ever. wonderful experience.,2024-08-21,,,,,,,
REV2791,Product_C,User_117,4.0,great value. amazing features.,2024-08-29,,,,,,,
REV2792,Product_E,User_111,2.0,customer service was bad. broke easily.,2024-09-21,,,,,,,
REV2793,Product_D,User_128,5.0,exceeded expectations. great value.,2023-06-10,,,,,,,
REV2794,Product_E,User_143,4.0,works perfectly. easy to use.,2023-10-01,,,,,,,
REV2795,Product_E,User_157,4.0,exceeded expectations. best purchase ever.,2023-12-30,,,,,,,
REV2796,Product_B,User_167,3.0,could be better. one star.,2023-04-08,,,,,,,
REV2797,Product_A,User_156,2.0,difficult to use. broke easily.,2023-03-26,,,,,,,
REV2798,Product_D,User_150,4.0,love this product. amazing features. met expectations.,2024-09-22,,,,,,,
REV2799,Product_E,User_141,5.0,exceeded expectations. best purchase ever.,2023-02-22,,,,,,,
REV2800,Product_E,User_102,2.0,worst purchase. one star. works as expected.,2023-12-05,,,,,,,
REV2801,Product_E,User_192,4.0,works perfectly. fantastic. nothing special.,2023-05-27,,,,,,,
REV2802,Product_C,User_184,4.0,wonderful experience. fantastic.,2024-03-26,,,,,,,
REV2803,Product_C,User_108,5.0,wonderful experience. great value. neither good nor bad.,2023-11-30,,,,,,,
REV2804,Product_A,User_121,2.0,terrible product. waste of money.,2024-02-12,,,,,,,
REV2805,Product_C,User_179,2.0,awful. awful.,2024-09-13,,,,,,,
REV2806,Product_D,User_188,2.0,one star. worst purchase.,2024-04-09,,,,,,,
REV2807,Product_D,User_122,1.0,very disappointed. waste of money.,2023-06-20,,,,,,,
REV2808,Product_E,User_142,2.0,broke easily. one star. works as expected.,2024-10-19,,,,,,,
REV2809,Product_A,User_195,3.0,it's okay. amazing features.,2024-04-12,,,,,,,
REV2810,Product_C,User_125,2.0,awful. difficult to use.,2024-06-01,,,,,,,
REV2811,Product_E,User_124,5.0,very satisfied. excellent quality.,2023-05-28,,,,,,,
REV2812,Product_B,User_144,2.0,one star. bad experience. some pros and cons.,2024-01-05,,,,,,,
REV2813,Product_C,User_134,3.0,met expectations. awful.,2023-11-05,,,,,,,
REV2814,Product_A,User_150,1.0,difficult to use. awful.,2024-12-26,,,,,,,
REV2815,Product_D,User_154,2.0,terrible product. does not work.,2024-11-29,,,,,,,
REV2816,Product_E,User_148,4.0,best purchase ever. works perfectly. works as expected.,2023-02-06,,,,,,,
REV2817,Product_D,User_153,5.0,five stars. works perfectly.,2024-10-23,,,,,,,
REV2818,Product_E,User_125,4.0,amazing features. amazing features. neither good nor bad.,2023-03-26,,,,,,,
REV2819,Product_C,User_122,3.0,average product. terrible product.,2023-12-18,,,,,,,
REV2820,Product_A,User_122,5.0,fantastic. works perfectly.,2024-04-10,,,,,,,
REV2821,Product_B,User_106,3.0,nothing special. broke easily.,2023-02-19,,,,,,,
REV2822,Product_E,User_156,1.0,worst purchase. awful.,2024-06-16,,,,,,,
REV2823,Product_A,User_186,5.0,great value. very satisfied.,2024-10-21,,,,,,,
REV2824,Product_D,User_140,1.0,worst purchase. poor quality.,2024-06-20,,,,,,,
REV2825,Product_A,User_137,3.0,average product. difficult to use.,2023-03-16,,,,,,,
REV2826,Product_C,User_196,5.0,works perfectly. excellent quality.,2024-10-25,,,,,,,
REV2827,Product_E,User_187,4.0,love this product. highly recommend. it's okay.,2023-02-04,,,,,,,
REV2828,Product_C,User_197,4.0,excellent quality. wonderful experience.,2023-12-11,,,,,,,
REV2829,Product_A,User_115,3.0,works as expected. best purchase ever.,2023-07-01,,,,,,,
REV2830,Product_A,User_133,3.0,average product. wonderful experience.,2024-03-14,,,,,,,
REV2831,Product_E,User_169,5.0,exceeded expectations. easy to use.,2023-02-17,,,,,,,
REV2832,Product_A,User_117,2.0,would not recommend. bad experience.,2024-08-22,,,,,,,
REV2833,Product_A,User_108,4.0,highly recommend. love this product. works as expected.,2023-06-03,,,,,,,
REV2834,Product_D,User_168,1.0,waste of money. would not recommend.,2023-09-04,,,,,,,
REV2835,Product_E,User_112,2.0,worst purchase. bad experience. could be better.,2024-09-12,,,,,,,
REV2836,Product_A,User_193,3.0,works as expected. worst purchase.,2023-04-27,,,,,,,
REV2837,Product_D,User_112,5.0,great value. best purchase ever.,2023-09-25,,,,,,,
REV2838,Product_D,User_170,1.0,very disappointed. awful.,2023-05-10,,,,,,,
REV2839,Product_E,User_177,5.0,great value. easy to use. average product.,2023-06-28,,,,,,,
REV2840,Product_D,User_154,4.0,wonderful experience. excellent quality.,2023-07-28,,,,,,,
REV2841,Product_D,User_169,2.0,worst purchase. does not work.,2024-12-07,,,,,,,
REV2842,Product_E,User_182,4.0,exceeded expectations. five stars. could be better.,2024-12-26,,,,,,,
REV2843,Product_D,User_114,1.0,one star. difficult to use.,2023-08-05,,,,,,,
REV2844,Product_C,User_199,1.0,customer service was bad. does not work.,2024-06-02,,,,,,,
REV2845,Product_B,User_191,3.0,nothing special. love this product.,2024-08-14,,,,,,,
REV2846,Product_E,User_106,5.0,best purchase ever. excellent quality. met expectations.,2023-06-04,,,,,,,
REV2847,Product_E,User_124,2.0,terrible product. customer service was bad.,2024-03-14,,,,,,,
REV2848,Product_C,User_197,2.0,does not work. broke easily.,2023-10-11,,,,,,,
REV2849,Product_B,User_147,3.0,met expectations. customer service was bad.,2023-01-21,,,,,,,
REV2850,Product_C,User_119,3.0,met expectations. missing features.,2023-04-22,,,,,,,
REV2851,Product_A,User_128,5.0,fantastic. fantastic.,2023-07-10,,,,,,,
REV2852,Product_C,User_102,3.0,could be better. terrible product.,2023-08-25,,,,,,,
REV2853,Product_D,User_186,3.0,decent for the price. would not recommend.,2024-07-06,,,,,,,
REV2854,Product_A,User_158,5.0,love this product. works perfectly.,2024-01-18,,,,,,,
REV2855,Product_D,User_146,3.0,works as expected. bad experience.,2024-03-21,,,,,,,
REV2856,Product_A,User_123,5.0,easy to use. excellent quality.,2024-09-19,,,,,,,
REV2857,Product_C,User_114,2.0,would not recommend. difficult to use. works as expected.,2024-07-15,,,,,,,
REV2858,Product_A,User_197,5.0,wonderful experience. highly recommend.,2024-05-02,,,,,,,
REV2859,Product_B,User_161,1.0,one star. customer service was bad.,2023-03-20,,,,,,,
REV2860,Product_B,User_170,2.0,difficult to use. bad experience.,2024-04-21,,,,,,,
REV2861,Product_B,User_180,3.0,some pros and cons. bad experience.,2023-12-23,,,,,,,
REV2862,Product_E,User_160,4.0,works perfectly. great value.,2023-01-22,,,,,,,
REV2863,Product_A,User_142,2.0,worst purchase. difficult to use.,2023-09-30,,,,,,,
REV2864,Product_B,User_193,5.0,love this product. easy to use.,2024-01-25,,,,,,,
REV2865,Product_D,User_163,5.0,works perfectly. amazing features.,2024-06-11,,,,,,,
REV2866,Product_E,User_141,1.0,poor quality. missing features.,2024-11-27,,,,,,,
REV2867,Product_E,User_137,2.0,customer service was bad. terrible product.,2023-09-08,,,,,,,
REV2868,Product_A,User_100,1.0,would not recommend. would not recommend. it's okay.,2023-08-04,,,,,,,
REV2869,Product_B,User_154,4.0,five stars. very satisfied. average product.,2023-08-16,,,,,,,
REV2870,Product_B,User_187,2.0,terrible product. bad experience. met expectations.,2023-02-25,,,,,,,
REV2871,Product_A,User_142,5.0,wonderful experience. best purchase ever.,2023-10-22,,,,,,,
REV2872,Product_C,User_129,2.0,does not work. difficult to use.,2024-12-08,,,,,,,
REV2873,Product_B,User_164,2.0,customer service was bad. terrible product.,2023-03-09,,,,,,,
REV2874,Product_E,User_120,3.0,some pros and cons. five stars.,2024-04-18,,,,,,,
REV2875,Product_C,User_155,2.0,very disappointed. would not recommend.,2024-11-21,,,,,,,
REV2876,Product_A,User_123,1.0,difficult to use. does not work.,2024-01-19,,,,,,,
REV2877,Product_D,User_198,1.0,customer service was bad. bad experience.,2024-07-27,,,,,,,
REV2878,Product_E,User_140,4.0,excellent quality. love this product.,2024-07-07,,,,,,,
REV2879,Product_B,User_116,2.0,customer service was bad. difficult to use. could be better.,2023-10-21,,,,,,,
REV2880,Product_C,User_156,3.0,works as expected. terrible product.,2024-04-26,,,,,,,
REV2881,Product_E,User_192,4.0,great value. love this product.,2024-12-10,,,,,,,
REV2882,Product_E,User_152,3.0,met expectations. five stars.,2024-06-11,,,,,,,
REV2883,Product_D,User_173,1.0,broke easily. terrible product.,2024-12-04,,,,,,,
REV2884,Product_E,User_170,4.0,excellent quality. wonderful experience.,2023-04-18,,,,,,,
REV2885,Product_B,User_109,3.0,it's okay. very disappointed.,2024-03-09,,,,,,,
REV2886,Product_D,User_100,1.0,waste of money. worst purchase. average product.,2024-03-13,,,,,,,
